CONSOLIDATED STATEMENTS OF COMPREHENSIVE INCOME - USD ($) $ in Millions ; 12 Months Ended,2017-01-29,2016-01-31,2015-01-25
Net income,"$ 1,666",$ 614,$ 631
Net unrealized gain (loss) on available-for-sale securities,(17),(6),3
Reclassification adjustments for net realized gain (loss) included in net income on available-for-sale securities,1,(2),0
Net change in unrealized gain (loss) on available-for-sale securities,(16),(8),3
Net unrealized gain (loss) on cash flow hedges,2,(4),0
Reclassification adjustments for net realized gain (loss) included in net income on cash flow hedges,2,0,0
Net change in unrealized gain (loss) on cash flow hedges,4,(4),0
Other comprehensive income (loss),(12),(12),3
Total comprehensive income,"$ 1,654",$ 602,$ 634
