"CONDENSED CONSOLIDATED BALANCE SHEETS (Parenthetical) - USD ($) $ in Millions ; Sep. 30, 2021 ; Dec. 31, 2020",2021-09-30,2020-12-31
Statement of Financial Position [Abstract],,
"Accounts receivable, allowance",$ 43,$ 55
Investment amortized cost,"$ 2,281","$ 2,281"
"Common stock, par value (in dollars per share)",$ 0.00001,$ 0.00001
"Common stock, authorized (in shares)","5,000,000,000","5,000,000,000"
"Common stock, issued (in shares)","1,918,591,000","1,849,794,000"
"Common Stock, outstanding (in shares)","1,918,591,000","1,849,794,000"
